"No.","Time","Source","Destination","Protocol","Length","Info","ttl"
"5670","66.066809","172.16.254.128","81.166.122.238","TCP","66","52405  >  80 [SYN] Seq=0 Win=8192 Len=0 MSS=1460 WS=256 SACK_PERM=1",""
"5673","66.168322","81.166.122.238","172.16.254.128","TCP","60","80  >  52405 [SYN, ACK] Seq=0 Ack=1 Win=64240 Len=0 MSS=1460",""
"5674","66.168368","172.16.254.128","81.166.122.238","TCP","54","52405  >  80 [ACK] Seq=1 Ack=1 Win=64240 Len=0",""
"5675","66.168792","172.16.254.128","81.166.122.238","HTTP","485","GET /nv2/Nv2-PC.zip HTTP/1.1 ",""
"5676","66.169023","81.166.122.238","172.16.254.128","TCP","60","80  >  52405 [ACK] Seq=1 Ack=432 Win=64240 Len=0",""
"5677","66.281184","81.166.122.238","172.16.254.128","TCP","1502","80  >  52405 [PSH, ACK] Seq=1 Ack=432 Win=64240 Len=1448 [TCP segment of a reassembled PDU]",""
"5678","66.282556","81.166.122.238","172.16.254.128","TCP","1502","80  >  52405 [PSH, ACK] Seq=1449 Ack=432 Win=64240 Len=1448 [TCP segment of a reassembled PDU]",""
"5679","66.282582","172.16.254.128","81.166.122.238","TCP","54","52405  >  80 [ACK] Seq=432 Ack=2897 Win=64240 Len=0",""
"5680","66.398200","81.166.122.238","172.16.254.128","TCP","1514","80  >  52405 [ACK] Seq=2897 Ack=432 Win=64240 Len=1460 [TCP segment of a reassembled PDU]",""
"5681","66.398201","81.166.122.238","172.16.254.128","TCP","1514","80  >  52405 [ACK] Seq=4357 Ack=432 Win=64240 Len=1460 [TCP segment of a reassembled PDU]",""
"5682","66.398202","81.166.122.238","172.16.254.128","TCP","1514","80  >  52405 [ACK] Seq=5817 Ack=432 Win=64240 Len=1460 [TCP segment of a reassembled PDU]",""
"5683","66.398283","172.16.254.128","81.166.122.238","TCP","54","52405  >  80 [ACK] Seq=432 Ack=7277 Win=64240 Len=0",""
"5684","66.398444","81.166.122.238","172.16.254.128","TCP","1514","80  >  52405 [ACK] Seq=7277 Ack=432 Win=64240 Len=1460 [TCP segment of a reassembled PDU]",""
"5685","66.398444","81.166.122.238","172.16.254.128","TCP","1514","80  >  52405 [ACK] Seq=8737 Ack=432 Win=64240 Len=1460 [TCP segment of a reassembled PDU]",""
"5686","66.398445","81.166.122.238","172.16.254.128","TCP","1514","80  >  52405 [ACK] Seq=10197 Ack=432 Win=64240 Len=1460 [TCP segment of a reassembled PDU]",""
"5687","66.398446","81.166.122.238","172.16.254.128","TCP","1514","80  >  52405 [ACK] Seq=11657 Ack=432 Win=64240 Len=1460 [TCP segment of a reassembled PDU]",""
"5688","66.398446","81.166.122.238","172.16.254.128","TCP","1514","80  >  52405 [ACK] Seq=13117 Ack=432 Win=64240 Len=1460 [TCP segment of a reassembled PDU]",""
"5689","66.398448","81.166.122.238","172.16.254.128","TCP","1514","80  >  52405 [ACK] Seq=14577 Ack=432 Win=64240 Len=1460 [TCP segment of a reassembled PDU]",""
"5690","66.398448","81.166.122.238","172.16.254.128","TCP","1514","80  >  52405 [ACK] Seq=16037 Ack=432 Win=64240 Len=1460 [TCP segment of a reassembled PDU]",""
"5691","66.398449","81.166.122.238","172.16.254.128","TCP","1514","80  >  52405 [ACK] Seq=17497 Ack=432 Win=64240 Len=1460 [TCP segment of a reassembled PDU]",""
"5692","66.398449","81.166.122.238","172.16.254.128","TCP","850","80  >  52405 [PSH, ACK] Seq=18957 Ack=432 Win=64240 Len=796 [TCP segment of a reassembled PDU]",""
"5693","66.398487","172.16.254.128","81.166.122.238","TCP","54","52405  >  80 [ACK] Seq=432 Ack=19753 Win=56144 Len=0",""
"5694","66.399238","172.16.254.128","81.166.122.238","TCP","54","[TCP Window Update] 52405  >  80 [ACK] Seq=432 Ack=19753 Win=64240 Len=0",""
"5695","66.499600","81.166.122.238","172.16.254.128","TCP","1514","80  >  52405 [ACK] Seq=19753 Ack=432 Win=64240 Len=1460 [TCP segment of a reassembled PDU]",""
"5696","66.499605","81.166.122.238","172.16.254.128","TCP","1514","80  >  52405 [ACK] Seq=21213 Ack=432 Win=64240 Len=1460 [TCP segment of a reassembled PDU]",""
"5697","66.499607","81.166.122.238","172.16.254.128","TCP","1514","80  >  52405 [ACK] Seq=22673 Ack=432 Win=64240 Len=1460 [TCP segment of a reassembled PDU]",""
"5698","66.499609","81.166.122.238","172.16.254.128","TCP","1466","80  >  52405 [PSH, ACK] Seq=24133 Ack=432 Win=64240 Len=1412 [TCP segment of a reassembled PDU]",""
"5699","66.499706","172.16.254.128","81.166.122.238","TCP","54","52405  >  80 [ACK] Seq=432 Ack=25545 Win=64240 Len=0",""
"5700","66.599453","81.166.122.238","172.16.254.128","TCP","1514","80  >  52405 [ACK] Seq=25545 Ack=432 Win=64240 Len=1460 [TCP segment of a reassembled PDU]",""
"5701","66.599455","81.166.122.238","172.16.254.128","TCP","1514","80  >  52405 [ACK] Seq=27005 Ack=432 Win=64240 Len=1460 [TCP segment of a reassembled PDU]",""
"5702","66.599456","81.166.122.238","172.16.254.128","TCP","1514","80  >  52405 [ACK] Seq=28465 Ack=432 Win=64240 Len=1460 [TCP segment of a reassembled PDU]",""
"5703","66.599456","81.166.122.238","172.16.254.128","TCP","1514","80  >  52405 [ACK] Seq=29925 Ack=432 Win=64240 Len=1460 [TCP segment of a reassembled PDU]",""
"5704","66.599457","81.166.122.238","172.16.254.128","TCP","1514","80  >  52405 [ACK] Seq=31385 Ack=432 Win=64240 Len=1460 [TCP segment of a reassembled PDU]",""
"5705","66.599457","81.166.122.238","172.16.254.128","TCP","1514","80  >  52405 [ACK] Seq=32845 Ack=432 Win=64240 Len=1460 [TCP segment of a reassembled PDU]",""
"5706","66.599458","81.166.122.238","172.16.254.128","TCP","1514","80  >  52405 [ACK] Seq=34305 Ack=432 Win=64240 Len=1460 [TCP segment of a reassembled PDU]",""
"5707","66.599460","81.166.122.238","172.16.254.128","TCP","1514","80  >  52405 [ACK] Seq=35765 Ack=432 Win=64240 Len=1460 [TCP segment of a reassembled PDU]",""
"5708","66.599460","81.166.122.238","172.16.254.128","TCP","1514","80  >  52405 [ACK] Seq=37225 Ack=432 Win=64240 Len=1460 [TCP segment of a reassembled PDU]",""
"5709","66.599461","81.166.122.238","172.16.254.128","TCP","1514","80  >  52405 [ACK] Seq=38685 Ack=432 Win=64240 Len=1460 [TCP segment of a reassembled PDU]",""
"5710","66.599462","81.166.122.238","172.16.254.128","TCP","1514","80  >  52405 [ACK] Seq=40145 Ack=432 Win=64240 Len=1460 [TCP segment of a reassembled PDU]",""
"5711","66.599463","81.166.122.238","172.16.254.128","TCP","1514","80  >  52405 [ACK] Seq=41605 Ack=432 Win=64240 Len=1460 [TCP segment of a reassembled PDU]",""
"5712","66.599463","81.166.122.238","172.16.254.128","TCP","1358","80  >  52405 [PSH, ACK] Seq=43065 Ack=432 Win=64240 Len=1304 [TCP segment of a reassembled PDU]",""
"5713","66.599520","172.16.254.128","81.166.122.238","TCP","54","52405  >  80 [ACK] Seq=432 Ack=44369 Win=54176 Len=0",""
"5714","66.599742","172.16.254.128","81.166.122.238","TCP","54","[TCP Window Update] 52405  >  80 [ACK] Seq=432 Ack=44369 Win=64240 Len=0",""
"5715","66.696239","81.166.122.238","172.16.254.128","TCP","1502","80  >  52405 [PSH, ACK] Seq=44369 Ack=432 Win=64240 Len=1448 [TCP segment of a reassembled PDU]",""
"5716","66.696907","81.166.122.238","172.16.254.128","TCP","1502","80  >  52405 [PSH, ACK] Seq=45817 Ack=432 Win=64240 Len=1448 [TCP segment of a reassembled PDU]",""
"5717","66.696949","172.16.254.128","81.166.122.238","TCP","54","52405  >  80 [ACK] Seq=432 Ack=47265 Win=64240 Len=0",""
"5718","66.887490","81.166.122.238","172.16.254.128","TCP","1514","80  >  52405 [ACK] Seq=47265 Ack=432 Win=64240 Len=1460 [TCP segment of a reassembled PDU]",""
"5719","66.887492","81.166.122.238","172.16.254.128","TCP","1490","80  >  52405 [PSH, ACK] Seq=48725 Ack=432 Win=64240 Len=1436 [TCP segment of a reassembled PDU]",""
"5720","66.887538","172.16.254.128","81.166.122.238","TCP","54","52405  >  80 [ACK] Seq=432 Ack=50161 Win=64240 Len=0",""
"5721","66.892723","81.166.122.238","172.16.254.128","TCP","1514","80  >  52405 [ACK] Seq=50161 Ack=432 Win=64240 Len=1460 [TCP segment of a reassembled PDU]",""
"5722","66.892726","81.166.122.238","172.16.254.128","TCP","1514","80  >  52405 [ACK] Seq=51621 Ack=432 Win=64240 Len=1460 [TCP segment of a reassembled PDU]",""
"5723","66.892728","81.166.122.238","172.16.254.128","TCP","1514","80  >  52405 [ACK] Seq=53081 Ack=432 Win=64240 Len=1460 [TCP segment of a reassembled PDU]",""
"5724","66.892730","81.166.122.238","172.16.254.128","TCP","1514","80  >  52405 [ACK] Seq=54541 Ack=432 Win=64240 Len=1460 [TCP segment of a reassembled PDU]",""
"5725","66.892732","81.166.122.238","172.16.254.128","TCP","1454","80  >  52405 [PSH, ACK] Seq=56001 Ack=432 Win=64240 Len=1400 [TCP segment of a reassembled PDU]",""
"5726","66.892734","81.166.122.238","172.16.254.128","TCP","1502","80  >  52405 [PSH, ACK] Seq=57401 Ack=432 Win=64240 Len=1448 [TCP segment of a reassembled PDU]",""
"5727","66.892899","172.16.254.128","81.166.122.238","TCP","54","52405  >  80 [ACK] Seq=432 Ack=58849 Win=64240 Len=0",""
"5728","66.893781","81.166.122.238","172.16.254.128","TCP","1502","80  >  52405 [PSH, ACK] Seq=58849 Ack=432 Win=64240 Len=1448 [TCP segment of a reassembled PDU]",""
"5729","66.993171","81.166.122.238","172.16.254.128","TCP","1502","80  >  52405 [PSH, ACK] Seq=60297 Ack=432 Win=64240 Len=1448 [TCP segment of a reassembled PDU]",""
"5730","66.993209","172.16.254.128","81.166.122.238","TCP","54","52405  >  80 [ACK] Seq=432 Ack=61745 Win=64240 Len=0",""
"5731","67.012503","81.166.122.238","172.16.254.128","TCP","1514","80  >  52405 [ACK] Seq=61745 Ack=432 Win=64240 Len=1460 [TCP segment of a reassembled PDU]",""
"5732","67.012506","81.166.122.238","172.16.254.128","TCP","1490","80  >  52405 [PSH, ACK] Seq=63205 Ack=432 Win=64240 Len=1436 [TCP segment of a reassembled PDU]",""
"5733","67.012551","172.16.254.128","81.166.122.238","TCP","54","52405  >  80 [ACK] Seq=432 Ack=64641 Win=64240 Len=0",""
"5734","67.213248","81.166.122.238","172.16.254.128","TCP","1514","80  >  52405 [ACK] Seq=64641 Ack=432 Win=64240 Len=1460 [TCP segment of a reassembled PDU]",""
"5735","67.213249","81.166.122.238","172.16.254.128","TCP","1514","80  >  52405 [ACK] Seq=66101 Ack=432 Win=64240 Len=1460 [TCP segment of a reassembled PDU]",""
"5736","67.213250","81.166.122.238","172.16.254.128","TCP","1514","80  >  52405 [ACK] Seq=67561 Ack=432 Win=64240 Len=1460 [TCP segment of a reassembled PDU]",""
"5737","67.213250","81.166.122.238","172.16.254.128","TCP","1514","80  >  52405 [ACK] Seq=69021 Ack=432 Win=64240 Len=1460 [TCP segment of a reassembled PDU]",""
"5738","67.213251","81.166.122.238","172.16.254.128","TCP","1454","80  >  52405 [PSH, ACK] Seq=70481 Ack=432 Win=64240 Len=1400 [TCP segment of a reassembled PDU]",""
"5739","67.213288","172.16.254.128","81.166.122.238","TCP","54","52405  >  80 [ACK] Seq=432 Ack=71881 Win=64240 Len=0",""
"5742","67.410573","81.166.122.238","172.16.254.128","TCP","1514","80  >  52405 [ACK] Seq=71881 Ack=432 Win=64240 Len=1460 [TCP segment of a reassembled PDU]",""
"5743","67.410575","81.166.122.238","172.16.254.128","TCP","1514","80  >  52405 [ACK] Seq=73341 Ack=432 Win=64240 Len=1460 [TCP segment of a reassembled PDU]",""
"5744","67.410576","81.166.122.238","172.16.254.128","TCP","1514","80  >  52405 [ACK] Seq=74801 Ack=432 Win=64240 Len=1460 [TCP segment of a reassembled PDU]",""
"5745","67.410576","81.166.122.238","172.16.254.128","TCP","1466","80  >  52405 [PSH, ACK] Seq=76261 Ack=432 Win=64240 Len=1412 [TCP segment of a reassembled PDU]",""
"5746","67.410615","172.16.254.128","81.166.122.238","TCP","54","52405  >  80 [ACK] Seq=432 Ack=77673 Win=64240 Len=0",""
"5747","67.412168","81.166.122.238","172.16.254.128","TCP","1502","80  >  52405 [PSH, ACK] Seq=77673 Ack=432 Win=64240 Len=1448 [TCP segment of a reassembled PDU]",""
"5748","67.412929","81.166.122.238","172.16.254.128","TCP","1502","80  >  52405 [PSH, ACK] Seq=79121 Ack=432 Win=64240 Len=1448 [TCP segment of a reassembled PDU]",""
"5749","67.412954","172.16.254.128","81.166.122.238","TCP","54","52405  >  80 [ACK] Seq=432 Ack=80569 Win=64240 Len=0",""
"5750","67.506392","81.166.122.238","172.16.254.128","TCP","1502","80  >  52405 [PSH, ACK] Seq=80569 Ack=432 Win=64240 Len=1448 [TCP segment of a reassembled PDU]",""
"5751","67.508739","81.166.122.238","172.16.254.128","TCP","1514","80  >  52405 [ACK] Seq=82017 Ack=432 Win=64240 Len=1460 [TCP segment of a reassembled PDU]",""
"5752","67.508743","81.166.122.238","172.16.254.128","TCP","1490","80  >  52405 [PSH, ACK] Seq=83477 Ack=432 Win=64240 Len=1436 [TCP segment of a reassembled PDU]",""
"5753","67.508843","172.16.254.128","81.166.122.238","TCP","54","52405  >  80 [ACK] Seq=432 Ack=84913 Win=64240 Len=0",""
"5754","67.509093","81.166.122.238","172.16.254.128","TCP","1502","80  >  52405 [PSH, ACK] Seq=84913 Ack=432 Win=64240 Len=1448 [TCP segment of a reassembled PDU]",""
"5755","67.609741","81.166.122.238","172.16.254.128","TCP","1502","80  >  52405 [PSH, ACK] Seq=86361 Ack=432 Win=64240 Len=1448 [TCP segment of a reassembled PDU]",""
"5756","67.609773","172.16.254.128","81.166.122.238","TCP","54","52405  >  80 [ACK] Seq=432 Ack=87809 Win=64240 Len=0",""
"5757","67.610215","81.166.122.238","172.16.254.128","TCP","1502","80  >  52405 [PSH, ACK] Seq=87809 Ack=432 Win=64240 Len=1448 [TCP segment of a reassembled PDU]",""
"5758","67.615545","81.166.122.238","172.16.254.128","TCP","1502","80  >  52405 [PSH, ACK] Seq=89257 Ack=432 Win=64240 Len=1448 [TCP segment of a reassembled PDU]",""
"5759","67.615580","172.16.254.128","81.166.122.238","TCP","54","52405  >  80 [ACK] Seq=432 Ack=90705 Win=64240 Len=0",""
"5760","67.616245","81.166.122.238","172.16.254.128","TCP","1502","80  >  52405 [PSH, ACK] Seq=90705 Ack=432 Win=64240 Len=1448 [TCP segment of a reassembled PDU]",""
"5761","67.710392","81.166.122.238","172.16.254.128","TCP","1502","80  >  52405 [PSH, ACK] Seq=92153 Ack=432 Win=64240 Len=1448 [TCP segment of a reassembled PDU]",""
"5762","67.710436","172.16.254.128","81.166.122.238","TCP","54","52405  >  80 [ACK] Seq=432 Ack=93601 Win=64240 Len=0",""
"5763","67.710870","81.166.122.238","172.16.254.128","TCP","1502","80  >  52405 [PSH, ACK] Seq=93601 Ack=432 Win=64240 Len=1448 [TCP segment of a reassembled PDU]",""
"5764","67.714134","81.166.122.238","172.16.254.128","TCP","1502","80  >  52405 [PSH, ACK] Seq=95049 Ack=432 Win=64240 Len=1448 [TCP segment of a reassembled PDU]",""
"5765","67.714188","172.16.254.128","81.166.122.238","TCP","54","52405  >  80 [ACK] Seq=432 Ack=96497 Win=64240 Len=0",""
"5766","67.716760","81.166.122.238","172.16.254.128","TCP","1502","80  >  52405 [PSH, ACK] Seq=96497 Ack=432 Win=64240 Len=1448 [TCP segment of a reassembled PDU]",""
"5767","67.810098","81.166.122.238","172.16.254.128","TCP","1502","80  >  52405 [PSH, ACK] Seq=97945 Ack=432 Win=64240 Len=1448 [TCP segment of a reassembled PDU]",""
"5768","67.810137","81.166.122.238","172.16.254.128","TCP","1502","80  >  52405 [PSH, ACK] Seq=99393 Ack=432 Win=64240 Len=1448 [TCP segment of a reassembled PDU]",""
"5769","67.810334","172.16.254.128","81.166.122.238","TCP","54","52405  >  80 [ACK] Seq=432 Ack=100841 Win=64240 Len=0",""
"5770","67.913433","81.166.122.238","172.16.254.128","TCP","1502","80  >  52405 [PSH, ACK] Seq=100841 Ack=432 Win=64240 Len=1448 [TCP segment of a reassembled PDU]",""
"5771","67.913685","81.166.122.238","172.16.254.128","TCP","1502","80  >  52405 [PSH, ACK] Seq=102289 Ack=432 Win=64240 Len=1448 [TCP segment of a reassembled PDU]",""
"5772","67.913750","172.16.254.128","81.166.122.238","TCP","54","52405  >  80 [ACK] Seq=432 Ack=103737 Win=64240 Len=0",""
"5773","67.914776","81.166.122.238","172.16.254.128","TCP","1502","80  >  52405 [PSH, ACK] Seq=103737 Ack=432 Win=64240 Len=1448 [TCP segment of a reassembled PDU]",""
"5774","67.915828","81.166.122.238","172.16.254.128","TCP","1502","80  >  52405 [PSH, ACK] Seq=105185 Ack=432 Win=64240 Len=1448 [TCP segment of a reassembled PDU]",""
"5775","67.915936","172.16.254.128","81.166.122.238","TCP","54","52405  >  80 [ACK] Seq=432 Ack=106633 Win=64240 Len=0",""
"5776","68.016369","81.166.122.238","172.16.254.128","TCP","1502","80  >  52405 [PSH, ACK] Seq=106633 Ack=432 Win=64240 Len=1448 [TCP segment of a reassembled PDU]",""
"5777","68.016826","81.166.122.238","172.16.254.128","TCP","1502","80  >  52405 [PSH, ACK] Seq=108081 Ack=432 Win=64240 Len=1448 [TCP segment of a reassembled PDU]",""
"5778","68.016849","172.16.254.128","81.166.122.238","TCP","54","52405  >  80 [ACK] Seq=432 Ack=109529 Win=64240 Len=0",""
"5779","68.017479","81.166.122.238","172.16.254.128","TCP","1502","80  >  52405 [PSH, ACK] Seq=109529 Ack=432 Win=64240 Len=1448 [TCP segment of a reassembled PDU]",""
"5780","68.018060","81.166.122.238","172.16.254.128","TCP","1502","80  >  52405 [PSH, ACK] Seq=110977 Ack=432 Win=64240 Len=1448 [TCP segment of a reassembled PDU]",""
"5781","68.018088","172.16.254.128","81.166.122.238","TCP","54","52405  >  80 [ACK] Seq=432 Ack=112425 Win=64240 Len=0",""
"5782","68.116793","81.166.122.238","172.16.254.128","TCP","1514","80  >  52405 [ACK] Seq=112425 Ack=432 Win=64240 Len=1460 [TCP segment of a reassembled PDU]",""
"5783","68.116796","81.166.122.238","172.16.254.128","TCP","1514","80  >  52405 [ACK] Seq=113885 Ack=432 Win=64240 Len=1460 [TCP segment of a reassembled PDU]",""
"5784","68.116797","81.166.122.238","172.16.254.128","TCP","1514","80  >  52405 [ACK] Seq=115345 Ack=432 Win=64240 Len=1460 [TCP segment of a reassembled PDU]",""
"5785","68.116798","81.166.122.238","172.16.254.128","TCP","1466","80  >  52405 [PSH, ACK] Seq=116805 Ack=432 Win=64240 Len=1412 [TCP segment of a reassembled PDU]",""
"5786","68.117272","172.16.254.128","81.166.122.238","TCP","54","52405  >  80 [ACK] Seq=432 Ack=118217 Win=64240 Len=0",""
"5787","68.229296","81.166.122.238","172.16.254.128","TCP","1502","80  >  52405 [PSH, ACK] Seq=118217 Ack=432 Win=64240 Len=1448 [TCP segment of a reassembled PDU]",""
"5788","68.232654","81.166.122.238","172.16.254.128","TCP","1514","80  >  52405 [ACK] Seq=119665 Ack=432 Win=64240 Len=1460 [TCP segment of a reassembled PDU]",""
"5789","68.232656","81.166.122.238","172.16.254.128","TCP","1514","80  >  52405 [ACK] Seq=121125 Ack=432 Win=64240 Len=1460 [TCP segment of a reassembled PDU]",""
"5790","68.232659","81.166.122.238","172.16.254.128","TCP","1478","80  >  52405 [PSH, ACK] Seq=122585 Ack=432 Win=64240 Len=1424 [TCP segment of a reassembled PDU]",""
"5791","68.232701","172.16.254.128","81.166.122.238","TCP","54","52405  >  80 [ACK] Seq=432 Ack=124009 Win=64240 Len=0",""
"5792","68.329924","81.166.122.238","172.16.254.128","TCP","1502","80  >  52405 [PSH, ACK] Seq=124009 Ack=432 Win=64240 Len=1448 [TCP segment of a reassembled PDU]",""
"5793","68.330743","81.166.122.238","172.16.254.128","TCP","1514","80  >  52405 [ACK] Seq=125457 Ack=432 Win=64240 Len=1460 [TCP segment of a reassembled PDU]",""
"5794","68.330745","81.166.122.238","172.16.254.128","TCP","1490","80  >  52405 [PSH, ACK] Seq=126917 Ack=432 Win=64240 Len=1436 [TCP segment of a reassembled PDU]",""
"5795","68.330777","172.16.254.128","81.166.122.238","TCP","54","52405  >  80 [ACK] Seq=432 Ack=128353 Win=64240 Len=0",""
"5796","68.334183","81.166.122.238","172.16.254.128","TCP","1502","80  >  52405 [PSH, ACK] Seq=128353 Ack=432 Win=64240 Len=1448 [TCP segment of a reassembled PDU]",""
"5797","68.334184","81.166.122.238","172.16.254.128","TCP","1502","80  >  52405 [PSH, ACK] Seq=129801 Ack=432 Win=64240 Len=1448 [TCP segment of a reassembled PDU]",""
"5798","68.334220","172.16.254.128","81.166.122.238","TCP","54","52405  >  80 [ACK] Seq=432 Ack=131249 Win=64240 Len=0",""
"5799","68.334703","81.166.122.238","172.16.254.128","TCP","1502","80  >  52405 [PSH, ACK] Seq=131249 Ack=432 Win=64240 Len=1448 [TCP segment of a reassembled PDU]",""
"5800","68.439307","81.166.122.238","172.16.254.128","TCP","1502","[TCP Retransmission] 80  >  52405 [PSH, ACK] Seq=131249 Ack=432 Win=64240 Len=1448",""
"5801","68.439332","172.16.254.128","81.166.122.238","TCP","54","52405  >  80 [ACK] Seq=432 Ack=132697 Win=62792 Len=0",""
"5802","68.531585","81.166.122.238","172.16.254.128","TCP","1514","80  >  52405 [ACK] Seq=132697 Ack=432 Win=64240 Len=1460 [TCP segment of a reassembled PDU]",""
"5803","68.531586","81.166.122.238","172.16.254.128","TCP","1514","80  >  52405 [ACK] Seq=134157 Ack=432 Win=64240 Len=1460 [TCP segment of a reassembled PDU]",""
"5804","68.531587","81.166.122.238","172.16.254.128","TCP","1514","80  >  52405 [ACK] Seq=135617 Ack=432 Win=64240 Len=1460 [TCP segment of a reassembled PDU]",""
"5805","68.531588","81.166.122.238","172.16.254.128","TCP","1514","80  >  52405 [ACK] Seq=137077 Ack=432 Win=64240 Len=1460 [TCP segment of a reassembled PDU]",""
"5806","68.531589","81.166.122.238","172.16.254.128","TCP","1514","80  >  52405 [ACK] Seq=138537 Ack=432 Win=64240 Len=1460 [TCP segment of a reassembled PDU]",""
"5807","68.531590","81.166.122.238","172.16.254.128","TCP","1514","80  >  52405 [ACK] Seq=139997 Ack=432 Win=64240 Len=1460 [TCP segment of a reassembled PDU]",""
"5808","68.531590","81.166.122.238","172.16.254.128","TCP","1514","80  >  52405 [ACK] Seq=141457 Ack=432 Win=64240 Len=1460 [TCP segment of a reassembled PDU]",""
"5809","68.531591","81.166.122.238","172.16.254.128","TCP","1418","80  >  52405 [PSH, ACK] Seq=142917 Ack=432 Win=64240 Len=1364 [TCP segment of a reassembled PDU]",""
"5810","68.531641","172.16.254.128","81.166.122.238","TCP","54","52405  >  80 [ACK] Seq=432 Ack=144281 Win=61416 Len=0",""
"5811","68.532035","172.16.254.128","81.166.122.238","TCP","54","[TCP Window Update] 52405  >  80 [ACK] Seq=432 Ack=144281 Win=64240 Len=0",""
"5812","68.532329","81.166.122.238","172.16.254.128","TCP","1502","80  >  52405 [PSH, ACK] Seq=144281 Ack=432 Win=64240 Len=1448 [TCP segment of a reassembled PDU]",""
"5813","68.620009","81.166.122.238","172.16.254.128","TCP","1502","80  >  52405 [PSH, ACK] Seq=145729 Ack=432 Win=64240 Len=1448 [TCP segment of a reassembled PDU]",""
"5814","68.620039","172.16.254.128","81.166.122.238","TCP","54","52405  >  80 [ACK] Seq=432 Ack=147177 Win=64240 Len=0",""
"5815","68.623404","81.166.122.238","172.16.254.128","TCP","1502","80  >  52405 [PSH, ACK] Seq=147177 Ack=432 Win=64240 Len=1448 [TCP segment of a reassembled PDU]",""
"5816","68.627052","81.166.122.238","172.16.254.128","TCP","1502","80  >  52405 [PSH, ACK] Seq=148625 Ack=432 Win=64240 Len=1448 [TCP segment of a reassembled PDU]",""
"5817","68.627099","172.16.254.128","81.166.122.238","TCP","54","52405  >  80 [ACK] Seq=432 Ack=150073 Win=64240 Len=0",""
"5818","68.715950","81.166.122.238","172.16.254.128","TCP","1502","80  >  52405 [PSH, ACK] Seq=150073 Ack=432 Win=64240 Len=1448 [TCP segment of a reassembled PDU]",""
"5819","68.717791","81.166.122.238","172.16.254.128","TCP","1502","80  >  52405 [PSH, ACK] Seq=151521 Ack=432 Win=64240 Len=1448 [TCP segment of a reassembled PDU]",""
"5820","68.717823","172.16.254.128","81.166.122.238","TCP","54","52405  >  80 [ACK] Seq=432 Ack=152969 Win=64240 Len=0",""
"5821","68.727212","81.166.122.238","172.16.254.128","TCP","1502","80  >  52405 [PSH, ACK] Seq=152969 Ack=432 Win=64240 Len=1448 [TCP segment of a reassembled PDU]",""
"5822","68.728467","81.166.122.238","172.16.254.128","TCP","1502","80  >  52405 [PSH, ACK] Seq=154417 Ack=432 Win=64240 Len=1448 [TCP segment of a reassembled PDU]",""
"5823","68.728521","172.16.254.128","81.166.122.238","TCP","54","52405  >  80 [ACK] Seq=432 Ack=155865 Win=64240 Len=0",""
"5824","68.811780","81.166.122.238","172.16.254.128","TCP","1502","80  >  52405 [PSH, ACK] Seq=155865 Ack=432 Win=64240 Len=1448 [TCP segment of a reassembled PDU]",""
"5825","68.812084","81.166.122.238","172.16.254.128","TCP","1502","80  >  52405 [PSH, ACK] Seq=157313 Ack=432 Win=64240 Len=1448 [TCP segment of a reassembled PDU]",""
"5826","68.812101","172.16.254.128","81.166.122.238","TCP","54","52405  >  80 [ACK] Seq=432 Ack=158761 Win=64240 Len=0",""
"5827","68.814459","81.166.122.238","172.16.254.128","TCP","1502","80  >  52405 [PSH, ACK] Seq=158761 Ack=432 Win=64240 Len=1448 [TCP segment of a reassembled PDU]",""
"5828","68.815013","81.166.122.238","172.16.254.128","TCP","1502","80  >  52405 [PSH, ACK] Seq=160209 Ack=432 Win=64240 Len=1448 [TCP segment of a reassembled PDU]",""
"5829","68.815040","172.16.254.128","81.166.122.238","TCP","54","52405  >  80 [ACK] Seq=432 Ack=161657 Win=64240 Len=0",""
"5830","68.834949","81.166.122.238","172.16.254.128","TCP","1502","80  >  52405 [PSH, ACK] Seq=161657 Ack=432 Win=64240 Len=1448 [TCP segment of a reassembled PDU]",""
"5831","68.835491","81.166.122.238","172.16.254.128","TCP","1502","80  >  52405 [PSH, ACK] Seq=163105 Ack=432 Win=64240 Len=1448 [TCP segment of a reassembled PDU]",""
"5832","68.835527","172.16.254.128","81.166.122.238","TCP","54","52405  >  80 [ACK] Seq=432 Ack=164553 Win=64240 Len=0",""
"5833","68.914501","81.166.122.238","172.16.254.128","TCP","1502","80  >  52405 [PSH, ACK] Seq=164553 Ack=432 Win=64240 Len=1448 [TCP segment of a reassembled PDU]",""
"5834","68.914714","81.166.122.238","172.16.254.128","TCP","1502","80  >  52405 [PSH, ACK] Seq=166001 Ack=432 Win=64240 Len=1448 [TCP segment of a reassembled PDU]",""
"5835","68.914747","172.16.254.128","81.166.122.238","TCP","54","52405  >  80 [ACK] Seq=432 Ack=167449 Win=64240 Len=0",""
"5836","68.915132","81.166.122.238","172.16.254.128","TCP","1502","80  >  52405 [PSH, ACK] Seq=167449 Ack=432 Win=64240 Len=1448 [TCP segment of a reassembled PDU]",""
"5837","68.915769","81.166.122.238","172.16.254.128","TCP","1502","80  >  52405 [PSH, ACK] Seq=168897 Ack=432 Win=64240 Len=1448 [TCP segment of a reassembled PDU]",""
"5838","68.915806","172.16.254.128","81.166.122.238","TCP","54","52405  >  80 [ACK] Seq=432 Ack=170345 Win=64240 Len=0",""
"5839","68.931408","81.166.122.238","172.16.254.128","TCP","1502","80  >  52405 [PSH, ACK] Seq=170345 Ack=432 Win=64240 Len=1448 [TCP segment of a reassembled PDU]",""
"5840","68.933749","81.166.122.238","172.16.254.128","TCP","1502","80  >  52405 [PSH, ACK] Seq=171793 Ack=432 Win=64240 Len=1448 [TCP segment of a reassembled PDU]",""
"5841","68.933792","172.16.254.128","81.166.122.238","TCP","54","52405  >  80 [ACK] Seq=432 Ack=173241 Win=64240 Len=0",""
"5842","69.015133","81.166.122.238","172.16.254.128","TCP","1502","80  >  52405 [PSH, ACK] Seq=173241 Ack=432 Win=64240 Len=1448 [TCP segment of a reassembled PDU]",""
"5843","69.017219","81.166.122.238","172.16.254.128","TCP","1502","80  >  52405 [PSH, ACK] Seq=174689 Ack=432 Win=64240 Len=1448 [TCP segment of a reassembled PDU]",""
"5844","69.017273","172.16.254.128","81.166.122.238","TCP","54","52405  >  80 [ACK] Seq=432 Ack=176137 Win=64240 Len=0",""
"5845","69.134853","81.166.122.238","172.16.254.128","TCP","1514","80  >  52405 [ACK] Seq=176137 Ack=432 Win=64240 Len=1460 [TCP segment of a reassembled PDU]",""
"5846","69.134855","81.166.122.238","172.16.254.128","TCP","1514","80  >  52405 [ACK] Seq=177597 Ack=432 Win=64240 Len=1460 [TCP segment of a reassembled PDU]",""
"5847","69.134855","81.166.122.238","172.16.254.128","TCP","1514","80  >  52405 [ACK] Seq=179057 Ack=432 Win=64240 Len=1460 [TCP segment of a reassembled PDU]",""
"5848","69.134856","81.166.122.238","172.16.254.128","TCP","1514","80  >  52405 [ACK] Seq=180517 Ack=432 Win=64240 Len=1460 [TCP segment of a reassembled PDU]",""
"5849","69.134857","81.166.122.238","172.16.254.128","TCP","1514","80  >  52405 [ACK] Seq=181977 Ack=432 Win=64240 Len=1460 [TCP segment of a reassembled PDU]",""
"5850","69.134858","81.166.122.238","172.16.254.128","TCP","1514","80  >  52405 [ACK] Seq=183437 Ack=432 Win=64240 Len=1460 [TCP segment of a reassembled PDU]",""
"5851","69.134858","81.166.122.238","172.16.254.128","TCP","1514","80  >  52405 [ACK] Seq=184897 Ack=432 Win=64240 Len=1460 [TCP segment of a reassembled PDU]",""
"5852","69.134859","81.166.122.238","172.16.254.128","TCP","1418","80  >  52405 [PSH, ACK] Seq=186357 Ack=432 Win=64240 Len=1364 [TCP segment of a reassembled PDU]",""
"5853","69.134949","172.16.254.128","81.166.122.238","TCP","54","52405  >  80 [ACK] Seq=432 Ack=187721 Win=61416 Len=0",""
"5854","69.135311","172.16.254.128","81.166.122.238","TCP","54","[TCP Window Update] 52405  >  80 [ACK] Seq=432 Ack=187721 Win=64240 Len=0",""
"5855","69.208909","81.166.122.238","172.16.254.128","TCP","1502","80  >  52405 [PSH, ACK] Seq=187721 Ack=432 Win=64240 Len=1448 [TCP segment of a reassembled PDU]",""
"5856","69.308993","81.166.122.238","172.16.254.128","TCP","1502","[TCP Retransmission] 80  >  52405 [PSH, ACK] Seq=187721 Ack=432 Win=64240 Len=1448",""
"5857","69.309054","172.16.254.128","81.166.122.238","TCP","54","52405  >  80 [ACK] Seq=432 Ack=189169 Win=62792 Len=0",""
"5858","69.420954","81.166.122.238","172.16.254.128","TCP","1514","80  >  52405 [ACK] Seq=189169 Ack=432 Win=64240 Len=1460 [TCP segment of a reassembled PDU]",""
"5859","69.420955","81.166.122.238","172.16.254.128","TCP","1514","80  >  52405 [ACK] Seq=190629 Ack=432 Win=64240 Len=1460 [TCP segment of a reassembled PDU]",""
"5860","69.420957","81.166.122.238","172.16.254.128","TCP","1514","80  >  52405 [ACK] Seq=192089 Ack=432 Win=64240 Len=1460 [TCP segment of a reassembled PDU]",""
"5861","69.420958","81.166.122.238","172.16.254.128","TCP","1514","80  >  52405 [ACK] Seq=193549 Ack=432 Win=64240 Len=1460 [TCP segment of a reassembled PDU]",""
"5862","69.420958","81.166.122.238","172.16.254.128","TCP","1514","80  >  52405 [ACK] Seq=195009 Ack=432 Win=64240 Len=1460 [TCP segment of a reassembled PDU]",""
"5863","69.420959","81.166.122.238","172.16.254.128","TCP","1514","80  >  52405 [ACK] Seq=196469 Ack=432 Win=64240 Len=1460 [TCP segment of a reassembled PDU]",""
"5864","69.420960","81.166.122.238","172.16.254.128","TCP","1514","80  >  52405 [ACK] Seq=197929 Ack=432 Win=64240 Len=1460 [TCP segment of a reassembled PDU]",""
"5865","69.420960","81.166.122.238","172.16.254.128","TCP","1418","80  >  52405 [PSH, ACK] Seq=199389 Ack=432 Win=64240 Len=1364 [TCP segment of a reassembled PDU]",""
"5866","69.421025","172.16.254.128","81.166.122.238","TCP","54","52405  >  80 [ACK] Seq=432 Ack=200753 Win=61416 Len=0",""
"5867","69.423295","172.16.254.128","81.166.122.238","TCP","54","[TCP Window Update] 52405  >  80 [ACK] Seq=432 Ack=200753 Win=64240 Len=0",""
"5868","69.433165","81.166.122.238","172.16.254.128","TCP","1502","80  >  52405 [PSH, ACK] Seq=200753 Ack=432 Win=64240 Len=1448 [TCP segment of a reassembled PDU]",""
"5869","69.515706","81.166.122.238","172.16.254.128","TCP","1502","80  >  52405 [PSH, ACK] Seq=202201 Ack=432 Win=64240 Len=1448 [TCP segment of a reassembled PDU]",""
"5870","69.515801","172.16.254.128","81.166.122.238","TCP","54","52405  >  80 [ACK] Seq=432 Ack=203649 Win=64240 Len=0",""
"5871","69.518258","81.166.122.238","172.16.254.128","TCP","1502","80  >  52405 [PSH, ACK] Seq=203649 Ack=432 Win=64240 Len=1448 [TCP segment of a reassembled PDU]",""
"5872","69.609827","81.166.122.238","172.16.254.128","TCP","1502","80  >  52405 [PSH, ACK] Seq=205097 Ack=432 Win=64240 Len=1448 [TCP segment of a reassembled PDU]",""
"5873","69.609866","172.16.254.128","81.166.122.238","TCP","54","52405  >  80 [ACK] Seq=432 Ack=206545 Win=64240 Len=0",""
"5874","69.610519","81.166.122.238","172.16.254.128","TCP","1502","80  >  52405 [PSH, ACK] Seq=206545 Ack=432 Win=64240 Len=1448 [TCP segment of a reassembled PDU]",""
"5875","69.624077","81.166.122.238","172.16.254.128","TCP","1502","80  >  52405 [PSH, ACK] Seq=207993 Ack=432 Win=64240 Len=1448 [TCP segment of a reassembled PDU]",""
"5876","69.624128","172.16.254.128","81.166.122.238","TCP","54","52405  >  80 [ACK] Seq=432 Ack=209441 Win=64240 Len=0",""
"5877","69.624532","81.166.122.238","172.16.254.128","TCP","1502","80  >  52405 [PSH, ACK] Seq=209441 Ack=432 Win=64240 Len=1448 [TCP segment of a reassembled PDU]",""
"5878","69.719103","81.166.122.238","172.16.254.128","TCP","1502","80  >  52405 [PSH, ACK] Seq=210889 Ack=432 Win=64240 Len=1448 [TCP segment of a reassembled PDU]",""
"5879","69.719145","172.16.254.128","81.166.122.238","TCP","54","52405  >  80 [ACK] Seq=432 Ack=212337 Win=64240 Len=0",""
"5880","69.719784","81.166.122.238","172.16.254.128","TCP","1502","80  >  52405 [PSH, ACK] Seq=212337 Ack=432 Win=64240 Len=1448 [TCP segment of a reassembled PDU]",""
"5881","69.720473","81.166.122.238","172.16.254.128","TCP","1502","80  >  52405 [PSH, ACK] Seq=213785 Ack=432 Win=64240 Len=1448 [TCP segment of a reassembled PDU]",""
"5882","69.720499","172.16.254.128","81.166.122.238","TCP","54","52405  >  80 [ACK] Seq=432 Ack=215233 Win=64240 Len=0",""
"5883","69.721299","81.166.122.238","172.16.254.128","TCP","1502","80  >  52405 [PSH, ACK] Seq=215233 Ack=432 Win=64240 Len=1448 [TCP segment of a reassembled PDU]",""
"5884","69.815076","81.166.122.238","172.16.254.128","TCP","1502","80  >  52405 [PSH, ACK] Seq=216681 Ack=432 Win=64240 Len=1448 [TCP segment of a reassembled PDU]",""
"5885","69.815113","172.16.254.128","81.166.122.238","TCP","54","52405  >  80 [ACK] Seq=432 Ack=218129 Win=64240 Len=0",""
"5886","69.815734","81.166.122.238","172.16.254.128","TCP","1502","80  >  52405 [PSH, ACK] Seq=218129 Ack=432 Win=64240 Len=1448 [TCP segment of a reassembled PDU]",""
"5887","69.911830","81.166.122.238","172.16.254.128","TCP","1502","80  >  52405 [PSH, ACK] Seq=219577 Ack=432 Win=64240 Len=1448 [TCP segment of a reassembled PDU]",""
"5888","69.911867","172.16.254.128","81.166.122.238","TCP","54","52405  >  80 [ACK] Seq=432 Ack=221025 Win=64240 Len=0",""
"5889","69.912462","81.166.122.238","172.16.254.128","TCP","1502","80  >  52405 [PSH, ACK] Seq=221025 Ack=432 Win=64240 Len=1448 [TCP segment of a reassembled PDU]",""
"5890","69.913120","81.166.122.238","172.16.254.128","TCP","1502","80  >  52405 [PSH, ACK] Seq=222473 Ack=432 Win=64240 Len=1448 [TCP segment of a reassembled PDU]",""
"5891","69.913136","172.16.254.128","81.166.122.238","TCP","54","52405  >  80 [ACK] Seq=432 Ack=223921 Win=64240 Len=0",""
"5892","69.913768","81.166.122.238","172.16.254.128","TCP","1502","80  >  52405 [PSH, ACK] Seq=223921 Ack=432 Win=64240 Len=1448 [TCP segment of a reassembled PDU]",""
"5893","70.010212","81.166.122.238","172.16.254.128","TCP","1502","80  >  52405 [PSH, ACK] Seq=225369 Ack=432 Win=64240 Len=1448 [TCP segment of a reassembled PDU]",""
"5894","70.010248","172.16.254.128","81.166.122.238","TCP","54","52405  >  80 [ACK] Seq=432 Ack=226817 Win=64240 Len=0",""
"5895","70.012843","81.166.122.238","172.16.254.128","TCP","1502","80  >  52405 [PSH, ACK] Seq=226817 Ack=432 Win=64240 Len=1448 [TCP segment of a reassembled PDU]",""
"5896","70.013333","81.166.122.238","172.16.254.128","TCP","1502","80  >  52405 [PSH, ACK] Seq=228265 Ack=432 Win=64240 Len=1448 [TCP segment of a reassembled PDU]",""
"5897","70.013355","172.16.254.128","81.166.122.238","TCP","54","52405  >  80 [ACK] Seq=432 Ack=229713 Win=64240 Len=0",""
"5898","70.013626","81.166.122.238","172.16.254.128","TCP","1502","80  >  52405 [PSH, ACK] Seq=229713 Ack=432 Win=64240 Len=1448 [TCP segment of a reassembled PDU]",""
"5899","70.108721","81.166.122.238","172.16.254.128","TCP","1502","80  >  52405 [PSH, ACK] Seq=231161 Ack=432 Win=64240 Len=1448 [TCP segment of a reassembled PDU]",""
"5900","70.108806","172.16.254.128","81.166.122.238","TCP","54","52405  >  80 [ACK] Seq=432 Ack=232609 Win=64240 Len=0",""
"5901","70.109418","81.166.122.238","172.16.254.128","TCP","1502","80  >  52405 [PSH, ACK] Seq=232609 Ack=432 Win=64240 Len=1448 [TCP segment of a reassembled PDU]",""
"5902","70.110521","81.166.122.238","172.16.254.128","TCP","1502","80  >  52405 [PSH, ACK] Seq=234057 Ack=432 Win=64240 Len=1448 [TCP segment of a reassembled PDU]",""
"5903","70.110543","172.16.254.128","81.166.122.238","TCP","54","52405  >  80 [ACK] Seq=432 Ack=235505 Win=64240 Len=0",""
"5904","70.111356","81.166.122.238","172.16.254.128","TCP","1502","80  >  52405 [PSH, ACK] Seq=235505 Ack=432 Win=64240 Len=1448 [TCP segment of a reassembled PDU]",""
"5905","70.209931","81.166.122.238","172.16.254.128","TCP","1502","80  >  52405 [PSH, ACK] Seq=236953 Ack=432 Win=64240 Len=1448 [TCP segment of a reassembled PDU]",""
"5906","70.209966","172.16.254.128","81.166.122.238","TCP","54","52405  >  80 [ACK] Seq=432 Ack=238401 Win=64240 Len=0",""
"5907","70.407485","81.166.122.238","172.16.254.128","TCP","1514","80  >  52405 [ACK] Seq=238401 Ack=432 Win=64240 Len=1460 [TCP segment of a reassembled PDU]",""
"5908","70.407486","81.166.122.238","172.16.254.128","TCP","1514","80  >  52405 [ACK] Seq=239861 Ack=432 Win=64240 Len=1460 [TCP segment of a reassembled PDU]",""
"5909","70.407486","81.166.122.238","172.16.254.128","TCP","1514","80  >  52405 [ACK] Seq=241321 Ack=432 Win=64240 Len=1460 [TCP segment of a reassembled PDU]",""
"5910","70.407487","81.166.122.238","172.16.254.128","TCP","1514","80  >  52405 [ACK] Seq=242781 Ack=432 Win=64240 Len=1460 [TCP segment of a reassembled PDU]",""
"5911","70.407487","81.166.122.238","172.16.254.128","TCP","1514","80  >  52405 [ACK] Seq=244241 Ack=432 Win=64240 Len=1460 [TCP segment of a reassembled PDU]",""
"5912","70.407488","81.166.122.238","172.16.254.128","TCP","1514","80  >  52405 [ACK] Seq=245701 Ack=432 Win=64240 Len=1460 [TCP segment of a reassembled PDU]",""
"5913","70.407488","81.166.122.238","172.16.254.128","TCP","1514","80  >  52405 [ACK] Seq=247161 Ack=432 Win=64240 Len=1460 [TCP segment of a reassembled PDU]",""
"5914","70.407489","81.166.122.238","172.16.254.128","TCP","1418","80  >  52405 [PSH, ACK] Seq=248621 Ack=432 Win=64240 Len=1364 [TCP segment of a reassembled PDU]",""
"5915","70.407545","172.16.254.128","81.166.122.238","TCP","54","52405  >  80 [ACK] Seq=432 Ack=249985 Win=61416 Len=0",""
"5916","70.407856","81.166.122.238","172.16.254.128","TCP","1502","80  >  52405 [PSH, ACK] Seq=249985 Ack=432 Win=64240 Len=1448 [TCP segment of a reassembled PDU]",""
"5917","70.407946","172.16.254.128","81.166.122.238","TCP","54","52405  >  80 [ACK] Seq=432 Ack=251433 Win=64240 Len=0",""
"5918","70.413715","81.166.122.238","172.16.254.128","TCP","1502","80  >  52405 [PSH, ACK] Seq=251433 Ack=432 Win=64240 Len=1448 [TCP segment of a reassembled PDU]",""
"5919","70.415019","81.166.122.238","172.16.254.128","TCP","1502","80  >  52405 [PSH, ACK] Seq=252881 Ack=432 Win=64240 Len=1448 [TCP segment of a reassembled PDU]",""
"5920","70.415043","172.16.254.128","81.166.122.238","TCP","54","52405  >  80 [ACK] Seq=432 Ack=254329 Win=64240 Len=0",""
"5921","70.514844","81.166.122.238","172.16.254.128","TCP","1502","80  >  52405 [PSH, ACK] Seq=254329 Ack=432 Win=64240 Len=1448 [TCP segment of a reassembled PDU]",""
"5922","70.518475","81.166.122.238","172.16.254.128","TCP","1502","80  >  52405 [PSH, ACK] Seq=255777 Ack=432 Win=64240 Len=1448 [TCP segment of a reassembled PDU]",""
"5923","70.518512","172.16.254.128","81.166.122.238","TCP","54","52405  >  80 [ACK] Seq=432 Ack=257225 Win=64240 Len=0",""
"5924","70.518875","81.166.122.238","172.16.254.128","TCP","1502","80  >  52405 [PSH, ACK] Seq=257225 Ack=432 Win=64240 Len=1448 [TCP segment of a reassembled PDU]",""
"5925","70.519780","81.166.122.238","172.16.254.128","TCP","1502","80  >  52405 [PSH, ACK] Seq=258673 Ack=432 Win=64240 Len=1448 [TCP segment of a reassembled PDU]",""
"5926","70.519806","172.16.254.128","81.166.122.238","TCP","54","52405  >  80 [ACK] Seq=432 Ack=260121 Win=64240 Len=0",""
"5927","70.618590","81.166.122.238","172.16.254.128","TCP","1502","80  >  52405 [PSH, ACK] Seq=260121 Ack=432 Win=64240 Len=1448 [TCP segment of a reassembled PDU]",""
"5928","70.619177","81.166.122.238","172.16.254.128","TCP","1514","80  >  52405 [ACK] Seq=261569 Ack=432 Win=64240 Len=1460 [TCP segment of a reassembled PDU]",""
"5929","70.619177","81.166.122.238","172.16.254.128","TCP","1490","80  >  52405 [PSH, ACK] Seq=263029 Ack=432 Win=64240 Len=1436 [TCP segment of a reassembled PDU]",""
"5930","70.619201","172.16.254.128","81.166.122.238","TCP","54","52405  >  80 [ACK] Seq=432 Ack=264465 Win=64240 Len=0",""
"5931","70.619647","81.166.122.238","172.16.254.128","TCP","1502","80  >  52405 [PSH, ACK] Seq=264465 Ack=432 Win=64240 Len=1448 [TCP segment of a reassembled PDU]",""
"5932","70.620140","81.166.122.238","172.16.254.128","TCP","1502","80  >  52405 [PSH, ACK] Seq=265913 Ack=432 Win=64240 Len=1448 [TCP segment of a reassembled PDU]",""
